[
  {
    "id": "basic_tower",
    "display_name": "Basic Tower",
    "element": "neutral",
    "role": "damage",
    "tier": 1,
    "rarity": "common",
    "arsenal_cost": 5,
    "build_cost": 100,
    "upgrade_cost": 50,
    "stats": {
      "damage": 10,
      "attack_speed": 1.0,
      "range": 5,
      "target_type": "ground",
      "projectile_speed": 10
    },
    "tags": ["starter"],
    "counters": [],
    "countered_by": [],
    "unlock_id": null,
    "visual_key": "basic_tower",
    "enabled": true
  },
  {
    "id": "fire_tower",
    "display_name": "Fire Tower",
    "element": "fire",
    "role": "damage",
    "tier": 2,
    "rarity": "uncommon",
    "arsenal_cost": 7,
    "build_cost": 150,
    "upgrade_cost": 75,
    "stats": {
      "damage": 15,
      "attack_speed": 0.9,
      "range": 5,
      "target_type": "ground",
      "projectile_speed": 12
    },
    "tags": ["fire"],
    "counters": [],
    "countered_by": [],
    "unlock_id": "unlock_fire_tower",
    "visual_key": "fire_tower",
    "enabled": true
  },
  {
    "id": "ice_tower",
    "display_name": "Ice Tower",
    "element": "ice",
    "role": "control",
    "tier": 2,
    "rarity": "uncommon",
    "arsenal_cost": 7,
    "build_cost": 150,
    "upgrade_cost": 75,
    "stats": {
      "damage": 12,
      "attack_speed": 0.95,
      "range": 5,
      "target_type": "ground",
      "projectile_speed": 11
    },
    "tags": ["ice"],
    "counters": [],
    "countered_by": [],
    "unlock_id": "unlock_ice_tower",
    "visual_key": "ice_tower",
    "enabled": true
  },
  {
    "id": "earth_tower",
    "display_name": "Earth Tower",
    "element": "earth",
    "role": "defense",
    "tier": 2,
    "rarity": "uncommon",
    "arsenal_cost": 7,
    "build_cost": 150,
    "upgrade_cost": 75,
    "stats": {
      "damage": 13,
      "attack_speed": 0.9,
      "range": 5,
      "target_type": "ground",
      "projectile_speed": 9
    },
    "tags": ["earth"],
    "counters": [],
    "countered_by": [],
    "unlock_id": "unlock_earth_tower",
    "visual_key": "earth_tower",
    "enabled": true
  },
  {
    "id": "storm_tower",
    "display_name": "Storm Tower",
    "element": "storm",
    "role": "damage",
    "tier": 3,
    "rarity": "rare",
    "arsenal_cost": 10,
    "build_cost": 250,
    "upgrade_cost": 125,
    "stats": {
      "damage": 20,
      "attack_speed": 0.8,
      "range": 6,
      "target_type": "air",
      "projectile_speed": 15
    },
    "tags": ["storm"],
    "counters": [],
    "countered_by": [],
    "unlock_id": "unlock_storm_tower",
    "visual_key": "storm_tower",
    "enabled": true
  },
  {
    "id": "poison_tower",
    "display_name": "Poison Tower",
    "element": "poison",
    "role": "damage",
    "tier": 3,
    "rarity": "rare",
    "arsenal_cost": 10,
    "build_cost": 250,
    "upgrade_cost": 125,
    "stats": {
      "damage": 18,
      "attack_speed": 0.85,
      "range": 5,
      "target_type": "ground",
      "projectile_speed": 10
    },
    "tags": ["poison"],
    "counters": [],
    "countered_by": [],
    "unlock_id": "unlock_poison_tower",
    "visual_key": "poison_tower",
    "enabled": true
  },
  {
    "id": "disabled_tower",
    "display_name": "Disabled Tower",
    "element": "void",
    "role": "damage",
    "tier": 1,
    "rarity": "common",
    "arsenal_cost": 5,
    "build_cost": 100,
    "upgrade_cost": 50,
    "stats": {"damage":10,"attack_speed":1.0,"range":5,"target_type":"ground","projectile_speed":10},
    "tags": ["disabled"],
    "counters": [],
    "countered_by": [],
    "unlock_id": null,
    "visual_key": "disabled_tower",
    "enabled": false
  }
]
